{
  "_generatedBegin": "BEGIN GENERATED AZ305 V1",
  "schemaVersion": "1.0.0",
  "labId": "LAB-00",
  "runId": "synthetic-000001",
  "result": "pass",
  "completedAt": "2026-09-02T00:00:00Z",
  "ownershipVerified": true,
  "activeManagedObjects": 0,
  "actions": []
  ,"_generatedEnd": "END GENERATED AZ305 V1"
}
